{
  "$schema": "https://json-schema.org/draft/2020-12/schema",
  "title": "ServiceSmith Field Map Override",
  "type": "object",
  "additionalProperties": false,
  "properties": {
    "customer_name": {"type": "string", "minLength": 1},
    "customer_email": {"type": "string", "minLength": 1},
    "customer_phone": {"type": "string", "minLength": 1},
    "customer_type": {"type": "string", "minLength": 1},
    "contact_first_name": {"type": "string", "minLength": 1},
    "contact_last_name": {"type": "string", "minLength": 1},
    "contact_title": {"type": "string", "minLength": 1},
    "location_name": {"type": "string", "minLength": 1},
    "subject": {"type": "string", "minLength": 1},
    "description": {"type": "string", "minLength": 1},
    "priority": {"type": "string", "minLength": 1},
    "status": {"type": "string", "minLength": 1},
    "external_id": {"type": "string", "minLength": 1},
    "address": {"type": "string", "minLength": 1},
    "city": {"type": "string", "minLength": 1},
    "state": {"type": "string", "minLength": 1},
    "zip": {"type": "string", "minLength": 1}
  }
}
